{
  "schemaVersion": 2,
  "datasetVersion": "eroute-disease-departments-v0.2",
  "catalogVersion": "diseases-v1",
  "vocabularyVersion": "departments-v1",
  "purpose": "HOSPITAL_DEPARTMENT_PERSONALIZATION",
  "purposeVersion": "map-disease-use-v2",
  "status": "READY",
  "publicMapApproved": false,
  "diseases": [
    {
      "id": "D001",
      "displayName": "천식",
      "aliases": [
        "기관지천식",
        "asthma"
      ],
      "category": "기저질환",
      "active": true,
      "lifecycleStatus": "ACTIVE",
      "version": 1
    },
    {
      "id": "D002",
      "displayName": "만성폐쇄성폐질환",
      "aliases": [
        "COPD",
        "만성 폐쇄성 폐질환"
      ],
      "category": "기저질환",
      "active": true,
      "lifecycleStatus": "ACTIVE",
      "version": 1
    },
    {
      "id": "D003",
      "displayName": "고혈압",
      "aliases": [
        "본태성고혈압",
        "hypertension"
      ],
      "category": "기저질환",
      "active": true,
      "lifecycleStatus": "ACTIVE",
      "version": 1
    },
    {
      "id": "D004",
      "displayName": "심방세동",
      "aliases": [
        "심방 세동",
        "AF",
        "atrial fibrillation"
      ],
      "category": "기저질환",
      "active": true,
      "lifecycleStatus": "ACTIVE",
      "version": 1
    },
    {
      "id": "D005",
      "displayName": "심부전",
      "aliases": [
        "heart failure"
      ],
      "category": "기저질환",
      "active": true,
      "lifecycleStatus": "ACTIVE",
      "version": 1
    },
    {
      "id": "D006",
      "displayName": "협심증",
      "aliases": [
        "angina",
        "angina pectoris"
      ],
      "category": "기저질환",
      "active": true,
      "lifecycleStatus": "ACTIVE",
      "version": 1
    },
    {
      "id": "D007",
      "displayName": "갑상선기능항진증",
      "aliases": [
        "갑상선 기능 항진증",
        "hyperthyroidism"
      ],
      "category": "기저질환",
      "active": true,
      "lifecycleStatus": "ACTIVE",
      "version": 1
    },
    {
      "id": "D008",
      "displayName": "갑상선기능저하증",
      "aliases": [
        "갑상선 기능 저하증",
        "hypothyroidism"
      ],
      "category": "기저질환",
      "active": true,
      "lifecycleStatus": "ACTIVE",
      "version": 1
    },
    {
      "id": "D009",
      "displayName": "만성 신부전",
      "aliases": [
        "만성신부전",
        "chronic renal failure"
      ],
      "category": "기저질환",
      "active": true,
      "lifecycleStatus": "ACTIVE",
      "version": 1
    },
    {
      "id": "D010",
      "displayName": "뇌전증",
      "aliases": [
        "간질",
        "epilepsy"
      ],
      "category": "기저질환",
      "active": true,
      "lifecycleStatus": "ACTIVE",
      "version": 1
    },
    {
      "id": "D011",
      "displayName": "파킨슨병",
      "aliases": [
        "Parkinson's disease"
      ],
      "category": "기저질환",
      "active": true,
      "lifecycleStatus": "ACTIVE",
      "version": 1
    },
    {
      "id": "D012",
      "displayName": "아토피성 피부염",
      "aliases": [
        "아토피",
        "아토피피부염"
      ],
      "category": "기저질환",
      "active": true,
      "lifecycleStatus": "ACTIVE",
      "version": 1
    },
    {
      "id": "D013",
      "displayName": "두드러기",
      "aliases": [
        "urticaria"
      ],
      "category": "기저질환",
      "active": true,
      "lifecycleStatus": "ACTIVE",
      "version": 1
    },
    {
      "id": "D014",
      "displayName": "간경변증",
      "aliases": [
        "간경변",
        "간경화",
        "liver cirrhosis"
      ],
      "category": "기저질환",
      "active": true,
      "lifecycleStatus": "ACTIVE",
      "version": 1
    },
    {
      "id": "D015",
      "displayName": "크론병",
      "aliases": [
        "Crohn병",
        "Crohn's disease"
      ],
      "category": "기저질환",
      "active": true,
      "lifecycleStatus": "ACTIVE",
      "version": 1
    },
    {
      "id": "D016",
      "displayName": "궤양성 대장염",
      "aliases": [
        "ulcerative colitis",
        "UC"
      ],
      "category": "기저질환",
      "active": true,
      "lifecycleStatus": "ACTIVE",
      "version": 1
    }
  ],
  "departments": [
    {
      "id": "DEP003",
      "canonicalName": "가정의학과",
      "active": true,
      "version": 1
    },
    {
      "id": "DEP018",
      "canonicalName": "결핵과",
      "active": true,
      "version": 1
    },
    {
      "id": "DEP019",
      "canonicalName": "구강내과",
      "active": true,
      "version": 1
    },
    {
      "id": "DEP020",
      "canonicalName": "구강병리과",
      "active": true,
      "version": 1
    },
    {
      "id": "DEP021",
      "canonicalName": "구강악안면방사선과",
      "active": true,
      "version": 1
    },
    {
      "id": "DEP022",
      "canonicalName": "구강악안면외과",
      "active": true,
      "version": 1
    },
    {
      "id": "DEP023",
      "canonicalName": "구강안면외과",
      "active": true,
      "version": 1
    },
    {
      "id": "DEP024",
      "canonicalName": "내과",
      "active": true,
      "version": 1
    },
    {
      "id": "DEP025",
      "canonicalName": "마취통증의학과",
      "active": true,
      "version": 1
    },
    {
      "id": "DEP026",
      "canonicalName": "방사선종양학과",
      "active": true,
      "version": 1
    },
    {
      "id": "DEP027",
      "canonicalName": "병리과",
      "active": true,
      "version": 1
    },
    {
      "id": "DEP028",
      "canonicalName": "비뇨의학과",
      "active": true,
      "version": 1
    },
    {
      "id": "DEP029",
      "canonicalName": "사상체질과",
      "active": true,
      "version": 1
    },
    {
      "id": "DEP030",
      "canonicalName": "산부인과",
      "active": true,
      "version": 1
    },
    {
      "id": "DEP031",
      "canonicalName": "산업의학과",
      "active": true,
      "version": 1
    },
    {
      "id": "DEP032",
      "canonicalName": "성형외과",
      "active": true,
      "version": 1
    },
    {
      "id": "DEP033",
      "canonicalName": "소아청소년과",
      "active": true,
      "version": 1
    },
    {
      "id": "DEP034",
      "canonicalName": "소아치과",
      "active": true,
      "version": 1
    },
    {
      "id": "DEP011",
      "canonicalName": "신경과",
      "active": true,
      "version": 1
    },
    {
      "id": "DEP012",
      "canonicalName": "신경외과",
      "active": true,
      "version": 1
    },
    {
      "id": "DEP035",
      "canonicalName": "심장혈관흉부외과",
      "active": true,
      "version": 1
    },
    {
      "id": "DEP036",
      "canonicalName": "안과",
      "active": true,
      "version": 1
    },
    {
      "id": "DEP037",
      "canonicalName": "영상의학과",
      "active": true,
      "version": 1
    },
    {
      "id": "DEP038",
      "canonicalName": "영상치의학과",
      "active": true,
      "version": 1
    },
    {
      "id": "DEP039",
      "canonicalName": "예방의학과",
      "active": true,
      "version": 1
    },
    {
      "id": "DEP040",
      "canonicalName": "예방치과",
      "active": true,
      "version": 1
    },
    {
      "id": "DEP041",
      "canonicalName": "외과",
      "active": true,
      "version": 1
    },
    {
      "id": "DEP042",
      "canonicalName": "응급의학과",
      "active": true,
      "version": 1
    },
    {
      "id": "DEP043",
      "canonicalName": "이비인후과",
      "active": true,
      "version": 1
    },
    {
      "id": "DEP044",
      "canonicalName": "작업환경의학과",
      "active": true,
      "version": 1
    },
    {
      "id": "DEP045",
      "canonicalName": "재활의학과",
      "active": true,
      "version": 1
    },
    {
      "id": "DEP046",
      "canonicalName": "정신건강의학과",
      "active": true,
      "version": 1
    },
    {
      "id": "DEP047",
      "canonicalName": "정형외과",
      "active": true,
      "version": 1
    },
    {
      "id": "DEP048",
      "canonicalName": "진단검사의학과",
      "active": true,
      "version": 1
    },
    {
      "id": "DEP049",
      "canonicalName": "치과",
      "active": true,
      "version": 1
    },
    {
      "id": "DEP050",
      "canonicalName": "치과교정과",
      "active": true,
      "version": 1
    },
    {
      "id": "DEP051",
      "canonicalName": "치과보존과",
      "active": true,
      "version": 1
    },
    {
      "id": "DEP052",
      "canonicalName": "치과보철과",
      "active": true,
      "version": 1
    },
    {
      "id": "DEP053",
      "canonicalName": "치료방사선과",
      "active": true,
      "version": 1
    },
    {
      "id": "DEP054",
      "canonicalName": "치주과",
      "active": true,
      "version": 1
    },
    {
      "id": "DEP055",
      "canonicalName": "침구과",
      "active": true,
      "version": 1
    },
    {
      "id": "DEP056",
      "canonicalName": "통합치의학과",
      "active": true,
      "version": 1
    },
    {
      "id": "DEP013",
      "canonicalName": "피부과",
      "active": true,
      "version": 1
    },
    {
      "id": "DEP057",
      "canonicalName": "한방내과",
      "active": true,
      "version": 1
    },
    {
      "id": "DEP058",
      "canonicalName": "한방부인과",
      "active": true,
      "version": 1
    },
    {
      "id": "DEP059",
      "canonicalName": "한방소아과",
      "active": true,
      "version": 1
    },
    {
      "id": "DEP060",
      "canonicalName": "한방신경정신과",
      "active": true,
      "version": 1
    },
    {
      "id": "DEP061",
      "canonicalName": "한방안이비인후피부과",
      "active": true,
      "version": 1
    },
    {
      "id": "DEP062",
      "canonicalName": "한방재활의학과",
      "active": true,
      "version": 1
    },
    {
      "id": "DEP063",
      "canonicalName": "해부병리과",
      "active": true,
      "version": 1
    },
    {
      "id": "DEP064",
      "canonicalName": "핵의학과",
      "active": true,
      "version": 1
    }
  ],
  "mappings": [],
  "departmentAliases": [],
  "broadDepartmentNames": [
    "내과",
    "외과",
    "소아청소년과"
  ]
}
